{
  "approvals": [],
  "architecture": {
    "source_of_truth": []
  },
  "compatibility": {
    "goalmanager_contract": ">=documented-v2",
    "research_gate": {
      "planning_implications": [
        "Keep security/integration RPD focus on the implementation phase.",
        "Require unit-test evidence before completion."
      ],
      "provider": "perplex",
      "query": "current safe patterns for auth-adjacent brownfield feature planning with tests",
      "required": true,
      "sources": [
        {
          "provider": "perplex",
          "title": "Fixture Perplex research record for chip-supergoal tests",
          "url": "https://example.com/chip-supergoal-research-fixture"
        }
      ],
      "status": "satisfied",
      "summary": "Fixture research confirms auth-adjacent brownfield work needs source-of-truth checks, explicit tests, and security-focused review before implementation phases."
    }
  },
  "contract_revision": 1,
  "decisions": [],
  "delivery": {
    "items": []
  },
  "goal": {
    "done_condition": "unit tests pass",
    "id": "sg-20260625-brownfield-feature",
    "non_goals": [
      "production deploy"
    ],
    "objective": "Ship one fixture feature with tests",
    "owner": "chip",
    "request_digest": "0000000000000000000000000000000000000000000000000000000000000000",
    "title": "Brownfield feature example",
    "workspace_root": "."
  },
  "loop": {
    "max_iterations": 3,
    "outcome_definition": {
      "outcome": "One fixture feature exists and its unit test passes.",
      "evidence": [
        "python3 -m unittest exits 0",
        "fixture.txt matches the compiled deliverable contract"
      ],
      "threshold": "All blocking criteria pass with zero unresolved P0/P1 findings.",
      "in_scope": [
        "fixture.txt",
        "fixture unit test"
      ],
      "out_of_scope": [
        "production deployment"
      ],
      "stop_and_ask": "Stop if the fixture contract conflicts with a user-owned source or requires a production effect."
    },
    "execution_profile": {
      "owner": "Sol",
      "planner_effort": "high",
      "integrator_effort": "max",
      "engineering_mode": "shawl",
      "worker_model": "gpt-5.6-luna",
      "worker_mode": "scout",
      "max_parallel_scouts": 3,
      "max_review_rounds": 3,
      "phase_routes": {
        "P01": "shawl"
      }
    }
  },
  "phases": [
    {
      "commands": [
        {
          "command": "python3 -m unittest",
          "id": "P01-CMD01",
          "purpose": "prove fixture",
          "safety": "local_read_write",
          "timeout_seconds": 120
        }
      ],
      "criteria": [
        {
          "blocking": true,
          "evidence_tier": "direct_artifact",
          "id": "P01-C01",
          "statement": "unit fixture test exits 0",
          "verifier": {
            "command_id": "P01-CMD01",
            "expected_assertion": "test passes",
            "expected_exit": 0,
            "type": "test"
          }
        }
      ],
      "deliverables": [
        {
          "change_expectation": "created_or_modified",
          "id": "P01-D01",
          "kind": "file",
          "path": "fixture.txt",
          "verification": "file_hash"
        }
      ],
      "depends_on": [],
      "id": "P01",
      "name": "Implement fixture",
      "ordinal": 1,
      "risk_tags": [
        "auth"
      ],
      "rpd": {
        "focus": [
          "security",
          "integration"
        ],
        "required": true
      },
      "task": "Add tested fixture",
      "work_items": [
        {
          "id": "P01-W01",
          "text": "edit fixture"
        }
      ]
    }
  ],
  "profile": "chip-private",
  "protocol_version": "3.0",
  "risks": [
    {
      "id": "RISK-001",
      "mitigation": "negative fixture",
      "severity": "P1",
      "tag": "auth"
    }
  ],
  "schema_version": "3.0",
  "source_set": []
}
